{
  "formatVersion": 1,
  "id": "app.mauri.fixtures.bundle.first",
  "name": "Bundle first",
  "version": "1.0.0",
  "author": "Cucuto fixtures",
  "license": "CC0-1.0",
  "characters": [
    {
      "id": "beep",
      "name": "Beep",
      "sprite": "characters/beep/sprite.png",
      "clips": [{ "file": "characters/beep/clips/beep.ogg" }]
    }
  ]
}
